Code;Txt_francais;D/W;Confiance;Justification
2862;2862 Je pensais que je suis une étourdie, pour ne pas dire sénile, parce que j'avais oublié de faire cet enregistrement aujourd'hui, et puis j'ai oublié de prendre la pilule deux fois, et voilà je suis un cas perdu désormais. Puis je me demandais si les bars peuvent être ouverts, on ne comprend pas, parce que je suis passée et il y avait un bar ouvert qui faisait des apéritifs, et les gens devant sur la place mais quand même à proximité du local, et donc je ne comprends pas quelles sont les règles. Maintenant je me préparais à retourner à l'[INSTITUTION1] et voilà, je pensais s'il fait froid dehors ou non, probablement oui et j'espère qu'il ne pleuvra pas.;;;
2863;"2863 J'ai effectué quelques opérations sur l'ordinateur parce que j'ai des problèmes de connexion ou de fonctionnement. Et donc d'un côté, une partie de mon esprit était concentré sur ce qu'il fait ; une autre partie de mon esprit était cependant ennuyée et distraite et n'était pas complètement, disons, présente. L'état d'esprit est de fatigue mentale et d'ennui. Heureusement aussi de soulagement en ce moment, parce que je peux quitter le travail.";;;
2864;2864 Je me suis un peu attardée à traîner un peu dehors parce qu'il pleuvait et ça me faisait plaisir de sentir de nouveau l'eau sur la peau. Rien d'autre d'extraordinaire. Je suis assez fatiguée parce que cette nuit j'ai peu dormi, cet après-midi je n'ai pas fait de choses particulières mais je pense qu'il sera bien ce soir d'aller se coucher un peu tôt, en espérant me reposer, dormir, plus que la nuit dernière. C'est tout. Rien d'extraordinaire, si ce n'est ce climat automnal qui arrive, comme il se doit, c'est septembre et c'est ainsi.;;;
2865;2865 Je fais trente choses ensemble parce que j'écoute mon fils en enregistrement vidéo parce qu'il est dans sa chambre parce qu'il est positif. Moi je suis en cuisine et je l'écoute, nous étudions ensemble la technique. En même temps je fais les pancakes, parce que j'ai décidé aujourd'hui de faire les pancakes, voilà. Donc mon esprit n'est pas vide, dans le sens qu'en ce moment je pense à trente mille choses ensemble. Tout va bien, tout est régulier, moi j'ai l'habitude de faire trente choses ensemble, donc tout ça ne me pèse pas. Bien.;;;
2866;2866 Il y avait moi, mon frère et ma meilleure amie et nous devions aller jouer au Monopoly, chez ma meilleure amie. Et je devais aussi dormir là-bas, et puis elle nous a raconté de mettre du sel sur le matelas. Et puis pratiquement il y avait des problèmes avec ce Monopoly. Mon frère voulait essayer de dessiner sur le Monopoly, alors je me suis mise en colère, je lui ai dit de ne pas abîmer le Monopoly. Il y avait quelque chose qui avait à voir avec des mannequins ou des strip-teaseuses.;;;
2867;2867 J'étais en train de discuter, presque en colère pour quelque chose.;;;
2868;2868 Mon père.;;;
2869;2869 Moi je suis dans une sorte de grand hôtel, avec beaucoup de chambres et beaucoup d'étages, et je suis responsable de devoir organiser la logistique d'un événement, un colloque, où ma compagne doit aussi intervenir. Et je dois m'occuper de tout préparer, monter les affaires, monter les chaînes stéréo, monter les systèmes d'écoute et tout. Et j'ai continuellement des personnes qui viennent me dire : « Tu dois faire comme ça, tu dois faire comme ci. » Moi j'essaie d'aider tout le monde, mais puis à un certain moment je fuis. Je me retrouve dans les sous-sols de cet immeuble et il y a un grand tas de choses inflammables : du bois, des roseaux et tout. Et moi j'essaie de les ranger, mais elles prennent feu. Je cherche des extincteurs, j'arrive à l'éteindre avec l'extincteur. Ma préoccupation cependant est que personne ne s'en soit aperçu. En effet je remonte, j'essaie de comprendre si quelqu'un s'est aperçu de quelque chose mais personne ne s'est aperçu de rien. Euh, tout est sur le point de commencer bientôt. Et je suis là avec des personnes que j'essaie de faire régler une chaîne stéréo pour pouvoir entendre les choses, une vieille chaîne stéréo style années Quatre-vingts de couleur orange et jaune, avec une marque. Moi je disais qu'elle était russe, bon. Et puis pratiquement l'événement commence. Moi à ce moment-là je deviens spectateur. Je suis dans le champ, je suis dans ce champ, dans ce pré plein de personnes, tous tournés vers cette maison hôtel où il y a cette chose dont ils parlent. Mais je me comporte comme un enfant stupide : je m'allonge par terre, j'applaudis, je me retourne, je tape des pieds, j'essaie d'attirer l'attention du public non pas vers le spectacle mais vers moi, c'est-à-dire non pas vers la conférence mais vers moi. Et j'y arrive avec quelques personnes qui rient et je suis content.;;;
2870;2870 Aujourd'hui ça a été une bonne journée. Peut-être pas riche de beaucoup d'émotions mais qualitativement, de bonnes émotions. Je suis sorti de la bibliothèque et je suis intéressé et intrigué par les choses que je suis en train de faire pour la présentation de lundi, présentation qui portera sur les couleurs, et sur ces couleurs il y a toute une série de choses intéressantes à dire au niveau de, mais les couleurs, qu'est-ce que sont les couleurs ? Voilà imaginez, la science, les couleurs qu'est-ce que c'est ? Sont-elles une construction culturelle, essentiellement à base linguistique ? Sont-elles quelque chose qui existe à l'intérieur du cerveau ? Je suppose que les neuroscientifiques ont une réponse préférée, mais je ne suis pas un neuroscientifique et pas non plus un linguiste pour ça. De toute façon je suis très intrigué par cette chose, je suis ainsi, assez galvanisé par cette journée d'hier, où j'ai peut-être été mal ou peut-être j'ai laissé à mon corps l'opportunité d'être un peu mal et me reposer, ça m'a ragaillardi, ça m'a redonné les forces et l'intérêt, ainsi, intellectuel, et donc je me sens, ainsi, intellectuellement stimulé. De plus je voudrais souligner comment depuis trois jours il y a un splendide croissant de lune, je crois que c'était il y a quatre jours ou au maximum cinq qu'il y avait nouvelle lune, et je suis sorti pour apercevoir la lune, lune croissante vraiment depuis le début, ce qui peut sembler une bêtise mais c'est une chose qui, venant de [PLACE1], qui est un endroit où la lune et les étoiles ne se voient jamais, j'arrive à la regarder, je suis en train de la regarder vraiment en ce moment, parce que ma fenêtre est droite vers l'ouest, d'où la lune se lève. Et la chose me remplit d'un sentiment enfantin, dans le sens positif du terme, un bonheur enfantin dans le sens positif du terme.;;;
2871;2871 Mon frère est à moitié en colère contre moi parce qu'il m'avait appelée pour se défouler de quelque problème à lui mais moi entre-temps, j'étais occupée par autre chose, je ne l'ai pas écouté, apparemment il en prend mal et alors nous nous rencontrons et lui hyper gonflé avait les muscles super gonflés de culturiste, puis nous voulions mettre genre des photos sur le mur ou les dessiner sur le mur et j'étais avec d'autres personnes et j'étais dans une maison avec deux autres personnes et nous faisions une fête, puis à un certain moment appelle euh [NAME1] qui venait juste de rentrer du Chili et qui était allée à la maison mais une de ses amies était restée coincée dans le débarras là-haut c'est-à-dire genre accrochée au plafond et alors elle avait besoin d'un coup de main ce qui était la raison pour laquelle je ne répondais pas à mon frère et entre-temps mon frère s'avère que la raison pour laquelle il m'appelait était parce qu'il était en train de voir une scène incroyable sur une rive d'un fleuve et il y avait des animaux, il y avait un phoque qui essayait de manger un genre de reptile, genre un caïman qui essayait de manger un serpent énorme et lui avait cette scène devant lui et était en train de la filmer et était super excité et voulait la partager avec moi euh mais entre-temps il y avait ce drame de cette personne accrochée au plafond du débarras de chez [NAME1] et puis mon frère après venait c'est-à-dire me pardonnait, faisait l'offensé mais puis m'apportait ces photos à accrocher au mur.;;;
2872;2872 Je suis un peu plus en forme que d'habitude, j'ai fait plus de choses que d'habitude, aujourd'hui. Je n'ai pas encore fini. Mais ça va, je suis un petit peu plus concentrée.;;;
2873;"2873 Je me trouvais à assister à une conférence, une sorte de conférence de presse, dans laquelle était en train de parler, euh, une femme, la nouvelle chancelière de la République fédérale d'Allemagne ou, euh, Ursula von der Leyen, et elle était en train de faire une présentation ; derrière sur le projecteur il y avait une carte de l'Union européenne, et pendant que, euh, elle parlait, moi j'écrivais sur des petits cartons de goûters du même type que ceux que l'on trouve à l'intérieur des Kinder Paradiso, euh, des chiffres de remboursement, apparemment, euh, pour moi ils avaient une signification spécifique, un pour chaque petit carton. Pendant la présentation la femme, qui était justement en train de présenter, remarque, comme nous tous d'ailleurs, que effectivement, euh, sur la carte qui est en train d'être projetée, euh, l'Italie n'y est pas, elle est vide, et les États qui ne font pas partie de l'Union, ne sont pas vraiment représentés sur la carte, euh, pour lequel, euh, embarrassée, euh, elle essaie d'y remédier en faisant apparaître de nulle part, euh, aussi l'Italie et, très embarrassée, euh, essaie de s'excuser en disant une phrase concernant, euh, notre système national de santé, du genre : « Ah, nous sommes tous contents que l'Italie fasse partie de l'Union, la seule chose que nous ne voudrions pas c'est votre santé désastreuse », quelque chose de similaire, et on entend des murmures provenir du reste de la salle. Moi-même je suis particulièrement à mi-chemin entre l'embarrassé et l'agacé par cette affirmation et à côté de moi il y a, euh, mon ami [NAME1], lui aussi il semble très agacé par cette affirmation de l'intervenante, à tel point de dire : « Eh autant qu'elle se l'épargnait cette phrase. » De plus, à un certain moment, l'intervenante s'adresse justement à lui, en lui demandant s'il a eu l'occasion d'effectivement résoudre, euh, des questions qu'il avait en suspens avec la responsable, euh, du bureau des services de l'école, euh, [INSTITUTION1].";;;
2874;2874 Je regardais Ça, que je n'avais jamais vu. Et bof, je ne sais pas trop quelles sensations j'éprouve. Le film ne me fait ni chaud ni froid. Mais en général depuis deux jours je suis, disons sexuellement excité et je n'arrive pas à penser à autre chose. C'est peut-être la sensation la plus présente ces deux derniers jours.;;;
2875;2875 Un rêve érotique avec une amie à moi qui s'appelait [NAME1]. Et nous avions mis une piscine, tout était très secret, caché. Il n'y avait pas de sexe explicite.;;;
2876;2876 Je venais juste de finir de rencontrer mon ami [NAME1] qui, étant donné qu'il est philosophe, m'a écouté pendant que je parlais de certaines thématiques concernant la thèse théorique que je dois préparer pour l'école de psychothérapie. Plus précisément certains sujets étroitement liés à la philosophie, lui étant philosophe. Donc pendant que je rentrais à la maison je pensais à certaines choses que nous nous étions dites sur les ouvertures au monde et sur les structures de sens de l'expérience humaine et comment les relier donc à la psychothérapie. Et pendant ce temps justement, je marchais pour rentrer à la maison, le climat était agréable. J'étais serein, très concentré sur ces sujets dont j'étais en train de parler. Et pour le reste j'étais assez tranquille. D'un autre côté j'étais aussi déjà un tout petit peu préoccupé par une série d'engagements que je sais devoir honorer dans ces trois jours fériés et donc disons, non pas qu'ils me distraient mais, enfin, je luttais aussi avec ces, avec ces pensées pour rester concentré sur ce dont j'avais parlé avec mon ami.;;;
2877;2877 J'étais à [PLACE1], mais je devais encore obtenir mon diplôme. Et donc j'allais dans la ville pour chercher une tenue pour la remise de diplôme, et comme première chose je vais dans un magasin géré par cette dame qui m'accueille à l'entrée. Et comme première chose je lui dis que je cherche la tenue pour la remise de diplôme, mais que je veux être libre d'en essayer autant que je veux, sans me sentir obligée d'acheter. Et elle me regarde genre « comment faire ? », comme pour dire « ok, qu'est-ce que je dois dire. » Puis je prends un petit haut qui était exposé devant le magasin et je vais vers la dame et je lui dis : « Voilà, déjà celui-ci je voudrais me l'acheter, donc ça n'a pas de sens ce que j'ai dit avant. » Et puis nous allons dans le magasin, elle me montre un peu de tenues, ainsi je commence à lui dire que je voudrais quand même mettre un pantalon avec un haut et peut-être une veste que j'ai déjà, et que peut-être je peux lui apporter une autre fois que j'y vais pour essayer des choses. Et elle commence à réfléchir un peu à ce qu'elle pourrait me faire essayer et je vois qu'elle regarde avec insistance des robes, genre toutes pailletées, comme ça, avec toutes les mega pierres comme ça. Et puis elle me dit : « Eh, celles-ci seraient belles. » Et je lui dis : « Non, mais je ne voudrais pas une robe, justement. » Elle : « En effet, en effet, celles-ci doivent être plutôt de soirée, vous vous décrochez peut-être le matin. » Ce que je n'avais jamais dit, c'est-à-dire que simplement je ne voulais pas mettre une robe, mais je dis : « Eh oui, en effet en effet. »;;;
2878;2878 Aujourd'hui je me sens particulièrement détendu et j'étais en train de compléter différentes choses, laissées en suspens dans ma journée, donc peut-être que ça influence... ma semaine, ma journée. Actuellement je travaille depuis la maison, j'écris la thèse. Il y a une petite brise agréable, je ne sais pas si ça peut aider. Mais justement, disons, malgré les différentes choses, les engagements de la journée, je me sens calme et détendu. J'avais plus de pensées après le réveil, mais justement à cet instant précis je n'en ai plus.;;;
2879;2879 Je me trouvais dans ce petit village. Je tournais, il n'y avait personne, c'était un petit village comme de montagne, très gris, très délabré. J'entrais dans une maison et il y avait des femmes habillées de noir. Et elles me faisaient manger comme du lait, c'était quelque chose de bon, je n'avais pas une mauvaise sensation. Elles parlaient continuellement à voix basse. C'était une sensation étrange. Ce n'était ni désagréable ni agréable. Pas des meilleures, mais ce n'était pas une sensation ni de peur ni de tristesse.;;;
2880;2880 Je me prépare à sortir, je me sens heureux, reposé, comblé et... avec de bonnes perspectives pour les prochains jours. J'ai l'impression d'avoir peu fait ces derniers jours, mais il me le fallait pour me reposer, donc je me sens vraiment reposé, chose qui ne s'était pas produite depuis longtemps.;;;
2881;2881 À l'examen on me demandait un sujet.;;;
2882;2882 Je vivais dans une grande villa avec quelques professeures du lycée. Je cherchais des lunettes à mettre pour pouvoir bronzer.;;;
2883;2883 J'étais en train de parler avec une femme qui par moments était [NAME1], nous étions dans une pièce assises et en réalité c'était elle qui parlait, elle me racontait quelque chose.;;;
2884;2884 Ce soir j'ai étudié. Et je suis un peu agacée parce que je n'ai pas réussi à étudier tout ce que je voulais, je suis un peu en retard, enfin. Et je dois beaucoup étudier dans ces jours, mais maintenant enfin je suis sur le point d'aller me coucher, ce qui est un des plus beaux moments de la journée.;;;
2885;2885 J'étais en Amérique du Sud, en Amérique centrale, un endroit plutôt Salvador, Guatemala ou peut-être un État mexicain. J'étais là avec un groupe de personnes, c'était un peu dans le style des Goonies, entre l'aventure et la criminalité, ceux qui nous attaquent, ceux qui nous encerclent.;;;
2886;2886 Il y avait la famille de l'ex directeur d'école de [PLACE1] qui partait de [PLACE1] et s'en allait, allait à Los Angeles. Pratiquement en y allant nous ne les reverrions plus et donc je pleurais, je m'accrochais à cette dame parce que je disais : « Tu m'as sauvé la vie, merci infiniment ! »;;;
2887;2887 J'ai été écrire le projet pour la bourse de recherche de [NAME1], en effet tu vois, je suis épuisé, un dimanche après-midi.;;;
2888;2888 J'étais avec des amis dehors et nous parlions de guides spirituels et nous étions à [PLACE1] et en particulier il y avait [NAME1] un de mes chers amis, [NAME2] une amie à moi que je n'avais pas vue depuis longtemps avec qui nous avons évoqué des souvenirs de réveillons à [PLACE2] où on avait l'impression d'être à Kaboul avec des bombes qui explosaient du matin au soir, [NAME1] qui dit qu'il veut se tuer tous les quatre matins en plaisantant mais en me faisant m'inquiéter et puis voilà [NAME3] qui en revanche est un garçon intéressant qui a un peu piqué mon intérêt et donc voilà j'étais gaie, amusée, j'ai revu [NAME4] un autre ami à moi que je n'avais pas vu depuis un moment avec lequel nous avons dit d'aller en Suède le plus tôt possible rendre visite à d'autres amis encore et voilà donc comme pensées qui me passaient par la tête relatives à ce moment-là il y avait justement des interactions eues et par la suite une balade à vélo où je pensais à quel point il faisait froid et à quel point tout compte fait mon existence était simple par rapport à celle d'autres personnes et j'ai hâte d'aller à [PLACE3] demain.;;;
2889;2889 J'ai fait tous les appels, parce que demain je commence un nouveau travail et donc, c'est-à-dire je voulais faire un peu le point de la situation pour comprendre où j'allais. Comment je me sens ? Je me sens donc un peu enthousiaste quand on commence quelque chose de nouveau, non ? Et en même temps aussi, enfin, concentrée, parce que je pense que je vais faire aussi un travail moins lourd, mais peut-être du point de vue psychologique peut-être plus préoccupant, disons, et donc je dois m'armer de patience comme ça, enfin. J'observe... c'est un vendredi soir mais ça semble samedi et il y a tout un va-et-vient de gens, de personnes. C'a été une journée où j'ai semé beaucoup et c'est bien ainsi.;;;
2890;2890 Cet après-midi je suis à la maison à étudier. J'ai pris un café parce que je commence à me sentir un peu fatiguée et la concentration commence à baisser un peu. La journée a été un peu longue et je suis un peu fatiguée, en effet. Ce soir j'essaierai d'aller me coucher un peu plus tôt. Je suis assez projetée vers l'examen, donc momentanément je me sens concentrée, un peu chargée d'adrénaline. Un peu stressée, comme toujours, en espérant réussir à atteindre l'objectif de la semaine et à étudier autant que je le voulais et me l'étais fixé. Je suis à la maison et ma colocataire elle aussi étudie et tout est assez silencieux.;;;
2891;2891 Je n'ai pas beaucoup pensé, je sors en centre-ville. Je suis arrivée en centre-ville en voiture mais je suis assez contente, tranquille, détendue. Parce que la journée est finie, et donc je peux sortir et ne plus penser à étudier. Et voilà, je suis contente parce que je vois une amie à moi que je ne vois pas souvent, parce qu'elle habite dans une autre ville.;;;
2892;2892 La journée a été assez frénétique donc la sensation actuelle est de stress parce que je devrais déjà être dans un autre endroit et au lieu de ça je n'ai pas encore fini l'engagement précédent, une série de journées à la course a commencé, je me l'imagine déjà, ce sont celles du retour au travail et de l'accumulation ensuite de situations et d'engagements divers.;;;
2893;2893 Je parlais avec diverses personnalités politiques et j'étais à une manifestation où il y a eu des des heurts.;;;
2894;2894 J'étais dans le désert et j'étais à la recherche d'une Vipera aspis, j'étais avec quelqu'un. À la fin nous trouvons les empreintes dans le sable du passage d'une vipère, nous suivons les empreintes et elles mènent à un terrier. Nous attendons un peu et après un moment la vipère sort du terrier. Tout d'un coup je me téléporte chez un ami à moi à [PLACE1]. Eh, en réalité je deviens vraiment mon ami, je m'incarne dans [NAME1], il s'appelle [NAME1] mon ami. Eh, je m'incarne dans [NAME1] qui est en train de faire une vidéo à envoyer à mes amis de [PLACE2], il met de la musique sur une enceinte dans sa chambre et puis prend un énorme beignet identique à celui des Simpson à manger et commence à le manger doucement.;;;
2895;2895 En réalité, j'étudiais. Je faisais la présentation de [NAME1] sur la « color perception », donc j'étais en salle d'étude assez silencieuse. Il y a peu de personnes et j'étais particulièrement concentrée sur ce que je faisais, aussi parce que c'est une chose assez éloignée de ce que je fais et donc j'ai des difficultés. Tout est silencieux, c'est une belle journée, donc il entre aussi un peu de soleil par la fenêtre de la salle d'étude. C'est sympa, agréable, mais je suis un peu fatiguée, un peu démotivée parce que pour cette présentation, je sais ne pas avoir beaucoup de temps pour la préparer, je la ressens comme une chose particulièrement difficile en ces jours. Et voilà, c'est tout. C'est-à-dire, plus ou moins ça. À la fin j'étudiais, donc voilà.;;;
2896;2896 Je viens juste de rentrer du marché aux antiquités et j'ai hâte d'écouter un disque que j'ai acheté... Des sensations positives, de la curiosité, je n'arriverais pas à dire ce que je pense vraiment. Je suis seulement envahi par le fait d'avoir vu beaucoup de choses, d'avoir été parler avec d'autres passionnés de musique et... des échanges d'idées, des échanges de choses, de disques que l'on ne connaît pas. Et donc je suis content, comblé et plein d'informations nouvelles.;;;
2897;2897 Je lisais « Un, personne et cent mille » de Pirandello, et peut-être aujourd'hui j'aurai la possibilité de le finir. Enfin j'ai la journée libre et donc je peux me consacrer à cette lecture. Et ça me plaît beaucoup et ça me fait aussi beaucoup réfléchir au fait qu'effectivement nous nous faisons une image des autres, et sans pouvoir vraiment les connaître tels qu'ils sont vraiment. La même chose les autres avec nous. Et donc ça me fait souvent réfléchir sur ma relation, parce que parfois je pense des choses à propos de mon petit ami et je me fais des idées aussi bien positives que négatives. En général qui peut-être ne correspondent pas à la réalité, donc je ne dois pas m'en laisser trop influencer, voilà. Puis, en réalité, dans l'après-midi j'aurais dû sortir avec des amis, enfin, après peut-être une semaine que je ne sors pas. Et au lieu de ça non. Parce qu'il m'est soudainement venu de nulle part ce rhume, peut-être je suis aussi un peu malade. Et donc probablement je ne pourrai pas sortir. Et ainsi je peux me consacrer à lire, à faire mes choses.;;;
2898;2898 Mon cousin ici à [PLACE1] m'accueillait chez lui et euh m'accueillait, on parlait de quelque chose, il y avait de la complicité.;;;
2899;2899 Mon frère malade.;;;
2900;2900 Il y avait un bal, une sorte de défilé dans lequel nous devions toutes défiler en filles, quelques garçons aussi, mais le défilé se déroulait dans une très grande maison, presque un palais. Il y avait énormément de personnes et je n'étais pas sûre de savoir ce que j'aurais dû faire, donc je me sentais un peu mal à l'aise et un peu jugée.;;;
2901;2901 J'avais un fils avec une autre femme, une dame un peu plus âgée que moi, ce n'est pas qu'on était ensemble. Nous avions ce fils qui vient de naître et je vivais avec ce fils dans une maison et cette dame aussi, de temps en temps. Mais elle avait aussi une autre maison avec son mari et plein d'autres enfants. Son mari était psychologue et avait tous ces enfants qui n'étaient pas tous de la même maman, il y avait aussi d'autres mamans. De toute façon, il avait une famille très élargie. Il y avait ce fils, c'est-à-dire j'avais ce fils et à un certain moment j'allais avec cette dame pour rencontrer son autre famille, et je laissais ce fils à la maison. Cependant, la police devait venir. Pour faire quelque chose avec cet enfant. Et donc il valait mieux qu'il y ait aussi quelqu'un d'autre avec cet enfant, quelqu'un qu'il connaissait quand la police viendrait. Donc nous étions dans la maison de cette dame et nous devions revenir tout de suite en arrière pour être avec ce fils. Et c'est tout. Puis elle rentrait à la maison et il y avait un monsieur devant la maison, qui la fixait et elle avait un peu peur. Elle était la femme avec qui j'avais ce fils, l'autre maman de cet enfant, et elle avait peur et me racontait qu'elle l'avait ensuite raconté à son mari. Son mari l'avait rassurée, enfin, et moi je lui disais : « Eh, quelle chance d'avoir un mari psychologue ! »;;;
