Code;Txt_francais;D/W;Confiance;Justification
2500;2500 Je jouais à quelque chose qui ressemblait à un jeu vidéo ou je regardais un film, il y avait une immense carte et je me jetais à l'eau, je nageais énormément et je finissais hors de cette carte conceptuellement utilisable et ensuite je devais faire face à une série de dangers, de choses, mais elles étaient insurmontables donc c'était plutôt une fuite, tourner en rond, mais comme on le fait dans un jeu vidéo, ne pas réussir à surmonter un obstacle et donc tourner autour dans cette petite carte et faire des choses en m'ennuyant surtout. C'était comme des monstres, la carte était un quai, au début c'était moi qui nageais, donc il y a eu ce changement-là. C'était toujours la nuit, tout était sombre, je nageais. Puis à un certain moment ça s'est transformé directement en une expérience que je voyais de l'extérieur.;;;
2501;"2501 Je transcrivais un cours de neuropharmacologie, et donc j'essayais, en somme, de comprendre tous les différents mécanismes ; et je réfléchissais aussi au fait que, même aujourd'hui, comme bien d'autres fois, je me sens fatiguée sans raison valable, étant donné que j'ai dormi neuf heures, peut-être même plus, et donc, en somme, je réfléchissais à ça. Je pensais aussi au fait que ce soir il y aura un barbecue chez moi et donc j'ai hâte de manger, de me gaver.";;;
2502;2502 Je suis sur le lit, je me repose un peu. La classique sieste d'après-déjeuner, et j'écoute un podcast qui s'intitule « Ci vuole una scienza » (Il faut de la science). Donc, évidemment, il parle de sujets scientifiques, des nouveautés du point de vue de la recherche ou des sujets d'actualité, des fake news qui sont démenties, etc. Très intéressant. Et j'ai l'intention d'étudier un peu d'anglais, je vais faire au moins une révision, donc je pensais faire ça. Et ensuite je devrai sortir faire un peu de courses. Et je pense que je m'ennuie un peu parce qu'il pleut pratiquement, mais je dois le faire absolument parce que je n'ai rien à manger. Et pour l'instant je ne pensais à rien d'autre, je me repose simplement un peu.;;;
2503;2503 J'étais tranquille parce que j'étais chez un ami et nous parlions de tout et de rien, de tout ce qui nous était arrivé ces derniers jours, des choses professionnelles, de tout, et je me sentais très tranquille et insouciante.;;;
2504;2504 Je suis un peu pressée parce que je me suis rendu compte que j'avais énormément de choses à faire, que je n'ai pas réussi à faire. Ça me fait de la peine parce que la journée semble déjà terminée, mais j'aurais envie de faire encore pas mal de choses. Le problème c'est que ma journée est toujours décalée, donc en réalité quand je devrais sortir dîner, c'est le moment où je devrais travailler le plus. La chose est cependant assez incompatible avec d'autres activités de type plus social, etc. Et quoi qu'il en soit tout va bien, j'ai pas mal de pensées en tête. On verra un peu comment se passent les prochaines heures. Je pense avoir fait beaucoup d'erreurs et s'il y a un moyen d'y remédier. Et de toute façon mieux vaut ne pas trop se forcer, laisser aller et voir un peu comment les événements évoluent. Le problème c'est toujours l'attente, voilà. Donc j'ai pensé un peu à ça.;;;
2505;2505 J'étais dans mon supermarché préféré à fureter dans les rayons, pas du côté alimentation mais du côté bricolage et DIY. Et donc, voilà, j'étais très intéressée, curieuse et captivée par des objets qui peuvent améliorer la vie quotidienne. Chaque fois que j'entre dans des magasins de cette chaîne, j'éprouve toujours une sensation d'émerveillement et presque de bien-être.;;;
2506;2506 J'étais avec des personnes, j'étais avec une amie. Nous avons essayé de réserver la pizzeria pour ce soir, mais nous n'y sommes pas arrivées. Cependant, j'étais assez tranquille, assez contente. Aussi parce que la journée d'aujourd'hui a été assez productive, malgré le fait que c'était dimanche. Et voilà, c'est plus ou moins ça. Maintenant autour de moi je suis seule. Je suis passée une seconde à la salle d'étude, mais tout est tranquille. Enfin, rien de notable.;;;
2507;2507 Je suis un peu fatiguée, quelques pensées négatives m'accompagnent. On me propose de sortir, mais je n'en ai pas envie. C'est comme si je me sentais un peu apathique ces derniers temps.;;;
2508;2508 J'étais sur une scène au travail, différente cependant, aussi bien l'endroit où j'étais que la scène elle-même, et certaines des personnes étaient des collègues de mon lieu de travail. Sur la scène des gens se produisaient, j'étais derrière et je regardais, mais tout partait à vau-l'eau, c'était très amusant à voir.;;;
2509;2509 Des insectes, mais ce n'étaient pas vraiment des insectes, c'étaient de petites choses qui marchaient et qui me dégoûtaient assez. J'étais immobile et ces choses marchaient vers moi, toutes ces petites choses. Et c'est tout, et je sentais qu'elles me dégoûtaient.;;;
2510;"2510 J'étais en voiture, en fait je me trouvais sur le siège arrière d'une voiture qui n'est pas la mienne, elle appartient à mes parents, et nous parcourions une route de montagne avec des lacets. Il faisait nuit, et nous étions justement au milieu d'une forêt. À côté du siège où j'étais, il y avait aussi mon compagnon [NAME1]. Nous étions proches d'un endroit imaginaire, très similaire cependant à [PLACE1]. Une fois arrivés là j'avais l'appareil photo et on commence à marcher. Justement, toujours dans le noir, et au milieu de cette forêt. Et j'avais dit que je voulais voir une sorte de petite maison qui avait été laissée à l'abandon parce qu'avant il y avait un shérif et maintenant il n'y en avait plus. Donc j'étais intéressée à la prendre pour en faire, dans le bilocal du bas, un studio photo, et y faire des expositions photographiques, tandis que dans la partie du haut sous les combles il y avait pratiquement une sorte de mansarde, je voulais l'aménager comme habitation pour m'y installer. Et donc voilà, pratiquement pour atteindre cette petite maison nous passons dans ce petit sentier, en bord de route jusqu'au moment où cependant un orage ou en tout cas une tempête s'était précédemment produit, qui avait fait tomber des arbres sur le sentier ; et donc ils bloquaient le passage, et donc nous étions contraints de traverser un petit pont. Puis de là nous transférer sur des rochers et à ce moment-là nous devions plonger dans la rivière qui séparait la route du sentier. Sauf qu'elle était assez haute parce qu'il y avait trente, quarante mètres, à peu près. Et de l'autre côté, ils avaient réussi à arriver, disons à dépasser les arbres, il y avait déjà mes parents, quelques amis, [NAME2], un ami à moi, et [NAME3], un autre ami à moi. Et avec moi il y avait, il y avait seulement [NAME1], mon petit ami. Et donc je lui dis : « Non, écoute [NAME1], il faut absolument sauter parce que c'est le seul moyen d'aller de l'autre côté. » Il me fait : « Mais comment c'est possible ? Eux ils sont secs, ils seront passés par un autre endroit ! » Et j'ai fait : « Non, parce que les peurs il faut les vaincre. » Et donc je lui dis : « Écoute, nous devons sauter coûte que coûte ! » « Non, mais j'ai peur ! » Puis j'ai fait : « Écoute, je passe en premier comme ça tu vois que ce n'est pas dangereux. » Et donc voilà, je plonge depuis ce rocher et, justement, il y avait trente, quarante mètres de vide avant l'eau. Et je plonge en chandelle. L'impact avec l'eau cependant est tranquille, en réalité c'était comme si j'avais plongé depuis un mètre. C'est-à-dire dans le sens où c'est vrai que la phase de chute était très longue, au moment où je me suis jetée jusqu'au moment où j'ai touché l'eau, ma perception était qu'il s'était écoulé beaucoup de temps. Quoi qu'il en soit de là, je suis entrée doucement dans l'eau. Une fois arrivée dans l'eau je vois que [NAME1] était déjà sur la rive et je fais : « Mais quand tu as sauté ? C'est-à-dire j'ai fait : « je suis sautée avant toi et je suis atterrie. » « Non, non. J'ai fait comme Tarzan avec la liane » et là j'ai fait : « moi je me serais plus amusée ! » Et à ce moment-là, peu après dans notre marche nous arrivons à atteindre cette petite maison. On entre par une petite pièce carrée sur la gauche de la maison. La pièce était moche, dans le sens où, de toute façon, la maison est mal entretenue, même si elle n'est pas sale. Les murs sont blancs avec une ligne bordeaux à peu près à hauteur de tête d'homme, donc un mètre quatre-vingts. Une bande d'environ, ce n'est pas étroit, je pense qu'elle faisait dans les vingt centimètres, qui longe tout le périmètre de la pièce. Et en faisant le tour de ce carré, on accède ensuite à une autre pièce par deux marches et à travers une porte, enfin, il n'y avait pas de porte en réalité : à travers une arche cependant au carré, c'est-à-dire comme s'il y avait l'espace pour loger la porte, mais sans le battant qui fermait. Et ça mène dans l'autre pièce rectangulaire, elle aussi blanche. Et celle-ci aussi avait une ligne toujours à hauteur d'homme, toujours de vingt centimètres, qui longeait tout le périmètre de la pièce, mais au lieu d'être bordeaux elle était verte, vert forêt à peu près, vert foncé. Et disons que ça m'a beaucoup plu et surtout parce que, disons, le village où nous étions la donnait. Personne n'en voulait. Et donc disons avant de dire oui, je vais voir le haut parce que de toute façon je dois y habiter et je voulais voir la chambre où j'aurais dû loger. Pour accéder à la partie supérieure, celle des combles, nous devions passer par l'extérieur, il y avait une échelle en bois à barreaux qui était posée à l'arrière de la maison. Je la monte et bien que ça semblait petit de l'extérieur, à l'intérieur c'était vraiment grand. Des dimensions de quatre-vingt-dix mètres carrés, alors qu'en réalité au maximum ça devait faire dans les dix mètres carrés. Et je dis : « Mais comment c'est possible ? Non ? C'est-à-dire il n'y a pas tout cet espace à vue d'œil ! » Et mon père me fait : « Non, non, mais parce qu'il y a une illusion d'optique, donc ça te semble grand, en réalité c'est petit, mais il y a beaucoup d'espace pour mettre tes affaires. » Et donc bon d'accord, alors c'est fait, dans le sens où je m'installe ici, ça a toujours été mon rêve et j'organiserai justement le studio photo pour les sports outdoor et pour quand il y a besoin justement pour des événements. Je ne sais pas s'ils organisent des stages d'été ou des stages d'hiver, je ferai les photos ici, dans ce contexte-là. Sur ce, tout contente, alors moi avec mes parents, avec mes amis, avec mon petit ami, nous décidons d'aller fêter cet achat, bon disons ce cadeau. Et donc nous nous déplaçons un peu plus haut, dans un autre petit village qui était identique à [PLACE2], très similaire, dans un établissement. J'arrive au comptoir et les autres sont déjà assis, ils ont déjà commandé, j'étais toujours là, avec le menu devant moi à décider quoi prendre, et à la fin je décide de prendre une boisson à base de mangue, de pistache et au-dessus je lui avais fait mettre de la crème avec de la granola à la pistache dessus. Il faut un peu de temps pour la préparer, ils me la donnent, je vais m'asseoir avec les autres.";;;
2511;2511 J'étais fiancée avec un garçon qui est un ami à moi. Quoi qu'il en soit j'étais avec lui et un soir nous étions sortis avec d'autres amis, d'autres couples, enfin. Et voilà, c'était comme un soir d'été, enfin nous étions tous en centre-ville, sortis tous ensemble. Et nous allions vers une sorte de petite machine qui se trouvait dans cette place de cette ville. Et il y avait une machine qui faisait des glaces, mais c'était un genre de self-service, quelque chose du genre. Et donc on mange cette glace. Et ensuite il devait y avoir un déjeuner chez lui. Quoi qu'il en soit, enfin, à un certain moment nous étions chez lui à faire un déjeuner. Il y avait aussi toujours lui, ce fiancé fantôme.;;;
2512;2512 Il y avait des délinquants, quelque chose lié à la légalité, quelque chose lié à la pègre.;;;
2513;2513 Je conduisais une voiture bordeaux monospace. C'était peut-être une Nissan Serena et le paysage alentour était désertique, mais avec quelques plantes, un peu comme le début du Sud de l'Italie, peut-être même plus exotique.;;;
2514;2514 Je me sens fatigué et anxieux.;;;
2515;2515 Mes amis me racontaient une de leurs soirées dans un endroit que nous ne fréquentons habituellement pas. Euh, ils me racontaient ce qui s'était passé à un certain moment de la soirée, qu'ils avaient rencontré quelqu'un d'inconnu, ils s'étaient mis à bavarder dans les toilettes etc., à partir de là ces personnages qu'ils avaient rencontrés sont devenus des personnes peintes dans un tableau et moi, comme si j'étais entré dans le tableau, je suis entré dans l'histoire de ces personnes qui, comme par magie, toujours au même endroit, donc dans le local qui ne l'était plus, des années auparavant étaient des bandits, des hors-la-loi armés d'épées et d'armes blanches qui s'étaient introduits dans cet endroit, avaient été faits prisonniers, avaient été torturés, avaient combattu. Puis on revient à parler dans un bar de ça, de qui ils étaient ou pas, elles pouvaient être ces personnes qui avaient cependant aussi un compte Instagram.;;;
2516;"2516 À peine la leçon de [NAME1] terminée — ce sont des sujets particulièrement ennuyeux — bref, à la fin [NAME1] a appelé moi et [NAME2] ainsi pour discuter d'une réunion que nous avions eue ce matin ; au début cet appel m'a mis, du moins à moi, dans un léger état d'inquiétude parce que je pensais qu'il voulait nous mettre davantage de pression sur le travail que nous devons faire parce qu'en effet c'est un travail qui devient plus important que prévu, donc voilà, et puis en réalité justement en nous appelant en réalité ça a été plus agréable que prévu dans le sens qu'il s'est proposé de nous envoyer du matériel utile pour développer le travail, donc en réalité justement cette légère inquiétude s'est dissipée et justement en réalité lui-même m'a relativement rassuré sur la chose, et voilà puis en revenant vers [INSTITUTION1] j'ai entendu cette collègue qui me enverra probablement un patient pour une évaluation, donc je suis content, un autre patient disons pour l'étude.";;;
2517;2517 Aujourd'hui j'ai travaillé dehors toute la journée et ensuite je me suis arrêtée à dîner avec des amis et des collègues. C'a été une journée très épuisante mais aussi très belle, très satisfaisante. J'étais à dîner avec des amis et c'était relaxant, une soirée sympa. Ce que je peux dire : un peu de fatigue, beaucoup de sommeil et un peu d'inquiétude parce que j'ai pris du retard sur certaines choses de travail, mais je compte demain matin tôt les affronter donc je ne suis pas si angoissée mais je sais que voilà j'ai beaucoup à faire et donc... je suis un peu, enfin, je dois encore régler les choses mais je suis fatiguée et je dois aller dormir. Et donc il y a un peu ça... pour le reste disons assez de satisfaction.;;;
2518;2518 Il y avait des insectes mais ce n'étaient pas vraiment des insectes, c'étaient des choses étranges, minuscules, [MISS] qui se multipliaient très rapidement et si elles s'approchaient de toi elles te changeaient pour ainsi dire la personnalité. Et en pratique j'étais sortie avec mes amis, et à un moment donné genre, je voyais que ceux-ci faisaient des choses bizarres, genre qu'ils étaient obnubilés par les plantes, disaient des choses étranges, avaient un regard fixé dans le vide, devenaient violents, et en pratique parce que ceux-là avaient été, euh, disons, euh, contaminés par ces petits organismes stupides, qui cependant c'est-à-dire ils étaient vraiment nombreux et ils étaient vraiment tous fous, et ils étaient pleins de ces choses, et donc, et voilà, à un moment disons qu'ils étaient vraiment méchants, parce qu'ils vivaient en symbiose, c'est-à-dire, ils étaient tous ensemble, exactement comme si c'était une secte, parce qu'en réalité ces organismes, c'est-à-dire, cherchaient à créer un seul être énorme pour conquérir le monde probablement. Et donc à un moment ces gens faisaient des choses bizarres, et moi je ne savais pas quoi faire parce que je ne devais pas me faire attraper par eux, je n'étais pas avec eux parce que moi je pensais un peu : « Ah tu vois parce que moi j'utilise une quantité de gel hydroalcoolique pour les mains » mais j'avais très peur d'être infectée moi aussi par ces petits organismes, mais à un moment c'était la pagaille parce que moi j'étais là à faire semblant de : « Uh ah oui à moi aussi j'aime les plantes », mais ceux-ci étaient soupçonneux, et moi j'étais là et je dis : « Mince ils vont me démasquer et me tuer et ou m'infecter » et donc j'étais là, puis à un moment j'ai dit : « Ah écoute j'ai un rendez-vous chez le médecin, et donc c'est-à-dire que je dois rester un peu seule » et genre en réalité j'ai croisé, pendant que je marchais, une fille que je connais, et à cette fille je lui ai dit, presque quand j'étais sur le point de lui faire la bise, parce qu'ensuite ils ne me lâchaient pas, ils voulaient tous m'accompagner absolument partout et je ne pouvais pas [MISS]. Et donc à un moment je me suis approchée pour lui faire la bise et je lui ai dit : « Ces gens-là veulent me tuer, je suis prise en otage. » Et c'est devenu la pagaille, et genre au milieu de ça ceux-ci s'en sont aperçus et ont commencé à l'infecter elle aussi, et donc c'est-à-dire que c'est un putain de foutoir. Et je ne savais pas quoi faire et puis genre j'allais à vélo et je devais changer le stationnement du vélo, mais j'étais en retard alors, puis une voiture rentrait.;;;
2519;2519 Je travaillais sur un projet de recherche. J'essayais d'écrire un article scientifique. Mais il y avait des choses que je n'arrivais vraiment pas à comprendre. C'était un travail sur les activations du cerveau lors d'activations du système nerveux au niveau périphérique et donc j'appelais sur Skype, avec connexion à distance, un collègue qui travaille sur ce sujet et je lui demandais des éclaircissements. Je parlais avec lui en me faisant expliquer ce qu'étaient différents paramètres pour différentes mesures que je ne comprenais pas.;;;
2520;2520 Ce que je vois en sortant de chez moi, d'une des deux maisons où j'ai habité à [PLACE1]. Et en face de moi s'ouvre un très beau panorama urbain, avec au loin ce que je sais être une université. Et puis la chose qui m'émerveille c'est que l'arc est immense, qui se trouve au milieu d'immeubles. Ils construisent une sorte d'amphithéâtre de garages. Euh une chose pas très belle à voir, mais je la trouve très ingénieuse, même si je me demande comment ils font ensuite, étant donné que je les vois très serrés, très étroits entre une rangée et l'autre, pour passer avec la voiture. Et puis je pense eh bien mais tout sera couvert et donc il y aura un beau jardin. Et je penserai « Ah quel dommage de ne plus être là maintenant que la ville devient de plus en plus belle ».;;;
2521;2521 Je suis dans ma chambre, je viens de finir de prendre une douche après m'être entraînée et je pense à plein de choses toutes en même temps. Par exemple que je m'entraîne trop en ce moment, je ne rentrerai bientôt plus dans mon pantalon, à quel point je gonfle dans les jambes, et je dois absolument me couper les cheveux parce qu'ils commencent à devenir de la paille. Et que dans cette chambre il fait vraiment trop chaud, chaque fois que je finis de me laver je suis de nouveau en sueur, comme si c'était le quinze août.;;;
2522;2522 J'ai discuté de projets possibles. Et en fait, pendant la discussion, l'esprit vagabondait un peu, parce que... je suis ici à [PLACE1], donc on voyait la lagune avec le brouillard qui montait et donc ça me distrayait un peu et je me demandais... quelle image absurde, imagine si de l'autre côté du brouillard tout disparaissait.;;;
2523;2523 Un numéro en tête que je continuais à répéter de manière obsessionnelle mais qui étrangement changeait toujours, chaque fois que j'essayais de le répéter comme avant. Quelque chose comme le numéro trois deux cinq sept neuf, ce genre de chose, mais ce n'était pas toujours le même numéro : c'était comme si c'était un code de tapis. Mais c'était aussi un numéro de téléphone. Je ne voyais pas d'images, je n'entendais pas de voix, je n'avais pas de sensations particulières, sinon un numéro, un numéro à cinq, six chiffres que je continuais à me répéter.;;;
2524;2524 J'étais à l'intérieur d'une arène type Colisée, nous étions des gladiateurs mais à notre époque et non à celle des Romains, nous ne combattions pas mais il y avait une confrontation générationnelle.;;;
2525;2525 Mes pensées, les images que je voyais, tournaient principalement autour des sujets dont on avait discuté hier avec les amis, et donc des questions liées aux vacances de Noël, aux déplacements, et aussi des thèmes plus proches de l'archéologie, de l'histoire de l'art. Et puis il y avait aussi encore quelques résidus certainement du weekend que j'ai passé chez moi, donc des sons, des images, des questions liées à la musique.;;;
2526;2526 Aujourd'hui c'était mon anniversaire et donc j'étais contente de tous les vœux que j'ai reçus et il y avait aussi la manifestation pour la libération de [PLACE1] du nazifascisme, le cinq septembre mil neuf cent quarante-quatre, et j'ai participé à la manifestation organisée par [MISS]. Et cependant voilà j'étais avec ces personnes de [MISS] mais pas nombreuses et toujours un peu les mêmes et c'est un peu décevant. Donc j'étais un peu, à ce moment-là, avec des sensations de faire quelque chose de bien mais je ne sais pas à quel point d'utile parce que peu suivi et puis nous avancions aussi un peu lentement donc j'avais aussi un peu envie à ce moment-là de me détacher et de faire une promenade plus constructive pour mon propre compte.;;;
2527;2527 J'étais en cours et je me sentais très fatiguée parce que j'avais été dehors toute la matinée, et puis j'avais couru au cours de quatorze heures à dix-huit heures. Et le cours en lui-même était un beau cours. Le professeur expliquait clairement, j'essayais de suivre, mais j'étais un peu perdue et j'attendais avec impatience que ça finisse.;;;
2528;2528 J'attends de faire le cours d'anglais. Et bon, honnêtement je pense que je ne pense à rien et je suis juste un peu fatiguée parce que j'ai fait le voyage en train. Je suis ici devant l'ordinateur, en attente de commencer l'appel. Je ne pensais à rien de particulier.;;;
2529;2529 Je fredonnais mentalement la chanson de Pino Daniele, c'était la chanson « io per lei, ho due occhi da bambino, na na se sei tu il mio destino allora portami via », et voilà avec le désir que mon compagnon soit un peu plus attentif à mon égard.;;;
