Code;Txt_francais;D/W;Confiance;Justification
2631;2631 Je venais juste de rentrer à la maison, tout frais d'une nouvelle expérience, j'ai commencé un stage qui fait partie du cours que je suis en train de finir. Et ça s'est passé exactement comme je m'y attendais, un désastre à l'école non communiqué. De manière très peu efficace avec l'entreprise, ils ont fait un bazar et donc enfin, je pensais à toutes ces choses-là. Je venais juste de rentrer à la maison et donc voilà. Belle journée, il y a une très belle lumière. Les chats qui miaulaient parce que dès que je rentre à la maison, évidemment ils ont besoin de me faire sentir leur présence et de me faire comprendre qu'ils ont faim et voilà. Donc justement quelques pensées sur comment résoudre certaines situations. Non, aussi heureuse, parce qu'aujourd'hui en fait le dernier jour avant un weekend hors de chez ma petite amie, donc à [PLACE1]. Donc, bien ainsi. Voilà heureusement, nous avons fini sur une note positive.;;;
2632;2632 Enfin bref, je suis rentré à la maison, tout va bien. Disons de toute façon, voilà, une sensation positive, et aussi une humeur positive, assez fatigué aujourd'hui cependant, enfin, c'a été un très beau weekend, enfin, reposant, dans le sens mais de toute façon un peu fatiguant, évidemment pour le voyage etc. Et... voilà. Il me semble que nous sommes arrivés au bout, disons de ce parcours. Et... aujourd'hui, enfin, ce sera la dernière nuit. Mais enfin voilà, je suis content. Aussi parce que de toute façon, voilà, partager ces... brefs disons instants de vie, mais enfin des moments non, puis enfin aussi les rêves que l'on fait etc. etc. je pense, enfin, de toute façon c'a été très intéressant. Voyons un peu ensuite les résultats.;;;
2633;2633 Tout compte fait c'a été une journée tranquille. Je me rends compte que quand on a des choses à faire on ne pense pas trop. Le problème c'est quand on a peu à faire. Qu'on se met là et qu'on pense au sens de la vie. Et je comprends que chacun d'entre nous a des problèmes, grands ou petits qu'ils puissent être, il n'est pas facile de trouver le chemin pour les résoudre. Mais bon.;;;
2634;2634 Le samedi c'est toujours un moment de repos après une semaine intense et normalement le samedi soir [NAME1] prépare la pizza enfin, et en ce moment nous sommes justement en train de préparer, d'étaler les pizzas pour les cuire.;;;
2635;2635 Ce matin je crois avoir oublié d'enregistrer. Mais de toute façon comme d'habitude, je me rappelais tout. Puis je me suis rendormi, je me suis réveillé et tout s'est effacé. Donc aucun souvenir.;;;
2636;2636 Une situation de travail difficile dont on n'arrivait pas à se sortir et qui m'a mis dans une condition de malaise particulier au sein de mon département. Et j'ai donc vécu dans une condition d'anxiété et d'angoisse parce qu'il fallait absolument conclure un projet avec une grande difficulté liée au fait que mes collaborateurs ne répondaient pas aux sollicitations et tout le groupe c'est comme s'il s'était en quelque sorte mutiné et échappait un peu aux demandes, me présentant toute une série de difficultés organisationnelles et techniques qui leur semblaient insolubles et qui au contraire, selon moi, étaient certainement abordables, c'est pourquoi c'a été une discussion continuelle.;;;
2637;2637 J'ai fini depuis peu de travailler sur l'ordinateur et je me sens satisfait, content parce que j'ai atteint les objectifs du jour, et je me sens aussi assez concentré.;;;
2638;2638 Ça concerne mon voisin de palier, j'étais allé là où il travaille habituellement. Euh, j'étais entré dans sa propriété et euh, et je me demandais où étaient ses chiens. J'avais un peu peur de comprendre d'où venaient ces chiens. Euh, et en effet puis à un certain moment euh, ils sortent de là où ils étaient et genre ils viennent vers moi, moi là sur le coup j'ai un peu peur mais puis euh, sort ce [NAME1] et euh, et à ce moment-là je me tranquillise. Et euh, après [NAME1] commence à donner à manger à un des chiens et lui donne des os. Je lui demande euh combien d'os il lui donne justement à manger et il dit bah qu'il lui en donne deux ou trois mais puis en réalité il lui en donne genre sept ou huit et, d'ailleurs, des os gigantesques. L'endroit était reproduit à quatre-vingt-quinze pour cent à la perfection sauf qu'ensuite, en revanche, il y avait les niches des chiens qui étaient mises dans des endroits différents. Bon, voilà ça. Puis il s'est passé autre chose, ça concernait toujours les chiens de mon voisin et mon voisin.;;;
2639;2639 Je me trouvais sur le canapé de mon salon devant la cheminée, je me réchauffais et de plus, dans la tranquillité de chez moi, j'ai pratiqué de l'autoerotisme. C'a été une belle expérience, pas seulement physique, mais aussi émotionnelle parce que je me suis sentie très détendue ensuite, pas seulement pour le plaisir physique, mais aussi pour le fait de me concentrer sur mon bien-être et j'étais apaisée parce que la pièce était dans la pénombre, n'ayant allumé que la lumière de la lampe et ayant la lumière de la cheminée et la couleur de la pièce c'est-à-dire vert pistache clair, contrastant avec la lumière, créait une ambiance dans la pénombre mais très relaxante et donc j'avais une perception de détente et d'épanouissement.;;;
2640;2640 Moi qui suis à l'université et je ne vois pas bien autour de moi, seulement ma voisine de banc qui est [NAME1]. Et donc je me comparais à son cahier. C'est-à-dire qu'en réalité elle avait un ordinateur pour prendre des notes et donc je feuilletais ses pages et les miennes pour voir combien de pages laisser.;;;
2641;2641 J'étais à la salle de sport à me faire malmener. Au crossfit. Donc je n'avais pas de grandes pensées.;;;
2642;2642 Je travaillais, j'allais interviewer une personne et puis je me retrouvais dans une de mes anciennes maisons, euh, comme si je l'avais en quelque sorte mise à la disposition de quelqu'un d'autre. Euh donc j'entrais dans cette vieille maison, je retrouvais les vieux objets, euh, de vieux souvenirs, et puis, soudainement, je me suis retrouvée à la mer.;;;
2643;2643 J'ai fini ma journée, entre guillemets, de travail, je viens de sortir. J'ai fait une partie à un jeu vidéo, je me suis amusé. Maintenant je rentre à la maison, parce que j'ai eu envie de pizza et il me semble que ce soir je me commande une pizza au lieu d'aller à la cantine. Par conséquent, j'ai très faim. Voilà, je suis content que ce soir des amis à moi viennent à la maison pour faire un jeu de société. C'est tout, je suis serein. Ce n'a pas été une journée particulièrement productive, donc je me suis peut-être senti un peu coupable, maintenant que je suis sorti de [INSTITUTION1]. Mais pour le reste tout va bien.;;;
2644;2644 Je jouais dans un concert. À un certain moment, arrivait une partie où il y avait un solo de contrebasse. Moi cependant je n'avais pas la partition et donc j'allais la chercher. Et quand je revenais je voyais qu'un de mes anciens professeurs était monté sur scène, de toute évidence parce qu'il avait décidé qu'il voulait la jouer lui. Ensuite, je me trouvais dans une autre salle où se trouvaient réunis certains de mes professeurs de contrebasse. Et j'éprouvais de la résistance, rien que dans le fait de les regarder. Probablement aussi dans le fait de leur parler. La sensation était de contraction, fermeture du cœur.;;;
2645;2645 Je participais à une aventure bizarre. Des émotions disons neutres, comme si ça avait été un jeu vidéo, comme si tout avait été normal. Donc ça avançait et tout se déroulait normalement. J'étais à la petite table avec un couple de personnes d'une cinquantaine d'années, elle blonde, qui s'en allaient ensuite. Et je restais là.;;;
2646;2646 J'étais chez moi et il y avait une fête au-dessus de chez moi. Euh sauf que j'avais peur de déranger ma grand-mère qui était en dessous. Alors je suis descendu, mais ma grand-mère était différente. C'est-à-dire qu'elle était en surpoids, elle avait des yeux énormes bleus et elle voulait vraiment que je l'embrasse mais elle semblait une psychopathe, ce n'était pas une belle chose, c'est-à-dire que moi j'avais vraiment peur de cette silhouette. Et oui, donc elle voulait vraiment m'embrasser, comme ça, mais c'est-à-dire euh c'était très laid, genre un monstre d'un jeu vidéo, les vieilles celles fantômes des jeux vidéo.;;;
2647;2647 Je parlais avec un collègue de faculté, de choses à demander à ma mère que j'avais laissée à [PLACE1].;;;
2648;2648 Je rentre à la maison après un micro séjour à [PLACE1] d'un jour et demi et je réfléchissais aux différentes formes d'intelligence, ayant passé justement ces deux jours avec une personne incroyablement intelligente du point de vue justement analytique, vraiment une intelligence livresque, mais aussi organisationnelle, managériale, tout. Cependant je m'interrogeais justement sur les différentes formes d'intelligence et sur comment des personnes avec différentes formes d'intelligence, comme par exemple l'intelligence émotionnelle, ou un peu plus introspective, un peu plus sociale, enfin, interpersonnelle, peut être perçue par une personne qui se considère intelligente seulement si elle a une intelligence de type, justement, livresque ou mathématique ou logique. Tout cela parce que, en réalité, j'ai aussi découvert qu'il existe une forme d'intelligence qui est celle intrapersonnelle, qui dénote justement une conscience de soi, de ses propres mécanismes, de ses propres pensées, ce qui est en réalité quelque chose que je considère assez rare. Et il y a d'autres formes d'intelligence, comme celle motrice, celle musicale, qui peuvent être un peu plus facilement intuibles. Donc je réfléchissais à comment différentes personnes sont perçues sur la base justement de différentes formes d'intelligence. Pour le reste je suis curieuse. Voilà, je me sens très curieuse.;;;
2649;2649 Je transcrivais certains morceaux de rêve, je les transcrivais mais je n'étais pas ici, et c'était une autre maison. J'étais en visite chez des oncles, c'était une maison qui n'était pas la leur, d'abord chez un oncle qui est à [PLACE1] puis chez un autre oncle qui pouvait être soit en [PLACE2] soit en [PLACE3] mais ce n'était absolument pas leur maison. C'étaient des maisons différentes. Le premier oncle j'étais là parce que j'étais malade. En réalité j'étais malade, j'étais debout et j'aurais pu sortir le lendemain et je pensais à ce que j'aurais pu lui offrir pour le remercier de cette hospitalité. Puis en réalité j'étais chez un autre oncle, il y avait sa fille c'est-à-dire ma cousine donc il était clair que c'était la maison de cet oncle et là justement j'enregistrais au dictaphone les rêves et je le portais avec moi, je me l'étais accroché au cou et j'enregistrais pendant que je marchais dans la maison et donc il y avait les différentes personnes, oncles, amis, des gens que je ne connaissais pas et il y avait cette cousine à moi qui intervenait de temps en temps pendant que j'enregistrais et moi j'essayais de la faire taire et de lui faire comprendre que j'enregistrais et que je ne devais être ni dérangée ni interrompue et j'enregistrais et je racontais donc le rêve que j'avais fait. Le rêve que j'avais fait j'étais chez moi de mon ex-mari, chez, oui, chez mon ex-mari, qui n'était pas ex et je m'étais mise en colère parce qu'on m'avait dit qu'on l'avait vu avec une autre personne donc je me disais ces choses je pensais à partir. Puis en revanche j'étais avec mon fils petit et avant vraiment avec les enfants de l'école à la mer avec ma collègue. C'était une sorte de terrasse nous avons mis ces enfants assis et la mer était en dessous, c'était l'hiver, il faisait froid donc nous regardions cette mer. Puis je suis retournée dans cet endroit mais avec mon fils petit qui à un certain moment, cet endroit pour y arriver était accessible depuis une route en montée, en descente, il y avait des pavés, il y avait du béton et à un certain moment il ne voulait pas marcher alors il s'était allongé par terre et moi je l'ai traîné par le capuchon peut-être de son blouson et à ce moment-là il est devenu un chat. Je l'ai pris dans mes bras, et puis quand nous sommes arrivés à cette terrasse sur la mer il était redevenu un enfant. Il s'est mis avec les autres enfants de l'école qui étaient là à regarder la mer et cette collègue à moi en réalité était dans l'eau avec un groupe d'enfants. Et ici en hiver donc il faisait froid mais ces enfants avaient voulu se baigner donc elle avait plongé et de temps en temps allait sous la tête parce que ne sachant pas nager peut-être elle ne touchait pas le fond et nous toutes faisions cette considération, c'était la seule personne qui ne savait pas nager, c'était une personne qui s'était en réalité plongée dans la mer. Et pourtant il me semblait qu'ils n'avaient pas froid, c'est-à-dire que chez eux il semblait que ce n'était pas l'hiver mais que c'était en réalité justement la saison pour se baigner. Donc moi je racontais tous ces rêves au dictaphone et j'étais chez ces oncles, chez cette cousine et j'allais dans les différentes pièces. À un certain moment je suis entrée dans la chambre de ma cousine où justement elle se trouvait et elle avait des photos du mariage de mon fils, et moi je lui ai demandé comment elle les avait eues, elle dit « mais comment, il y a un site où il y a toutes ces photos, tu dois y aller toi aussi, tu te les faisais imprimer » et puis elle avait la photo du mariage de mes grands-parents mais avec mes grands-parents qui se mariaient mais il y avait ma maman qui était la première fille donc comme si mes grands-parents s'étaient mariés après que ma maman était née. Et une photo donc petite, en noir et blanc, et je la regardais et derrière cette photo il était écrit tout un commentaire et je n'arrivais pas à lire ce commentaire parce que j'enregistrais, donc je me suis pris cette photo en main, me promettant que dès que l'enregistrement serait fini de la lire, de demander des explications et de la regarder. Puis en réalité j'ai fini cet enregistrement c'est-à-dire que j'ai fini de raconter les rêves que j'avais faits.;;;
2650;2650 Un garçon habillé avec ce manteau croisé, un appareil photo argentique plutôt vieux, mais compact et petit, lui avec des lunettes, ces cheveux noirs, mi-longs, une grande moustache et le bouc. En plein air probablement à la campagne, une maison au fond, une belle journée. Une journée hivernale parce qu'il était habillé avec le manteau. En pratique je le suis partout parce que je dois le convaincre de quelque chose. Et j'essaie de le convaincre d'une chose dont je suis convaincu moi, elle est juste et pas comme il dit lui. À un certain moment je vais le chercher chez sa maman, donc un environnement fermé, ce couloir très large avec cette rangée de portes. Pas un environnement qui rappelle celui d'une résidence, plutôt celui du hall d'un supermarché ou d'un hôpital. Voilà, ça ressemblait plus à un hôpital. Et donc je frappe à la porte, sa mère m'ouvre et j'essaie de convaincre sa mère parce que lui ne se voit pas.;;;
2651;2651 J'étais sorti avec le chien puis je suis remonté à la maison. Et je rangeais un peu. Parce que des amis à moi arrivent. Je ne pensais à rien de particulier. Je suis assez serein.;;;
2652;2652 Nous étions bof, dans une maison, je crois chez la maman d'une amie à moi, et elle avait organisé un dîner. Il y avait une table, il y avait ma famille, nous devions nous asseoir, nous étions déjà assis à cette table en attendant une personnalité. Celle-ci devait être Aretha Franklin. Et pendant que nous l'attendions, il s'avère que les places où nous nous étions assis auraient en réalité dû être réservées aux autorités. Des autorités qui cependant ne seraient certainement pas venues. Donc nous pouvions y rester quand même. Puis quand cette personnalité arrive elle est annoncée par une sorte de son, de sirène. Et nous nous penchons à la fenêtre pour voir, mais je savais déjà que, ça devait être Aretha Franklin, mais ça ne l'aurait pas été. Et ensuite je vois que c'est un homme, la personnalité que tout le monde attendait. Et alors je pense, c'est peut-être le fils. Il y avait trois, quatre personnes. La chose drôle c'est que quand il entre tout le monde se lève pour l'accueillir mais lui voulait demander des choses en anglais, en réalité il ne parlait pas, donc nous ne pouvions pas comprendre. Et quelqu'un, la maîtresse de maison nous accusait de ne pas savoir l'anglais, mais nous disions : « mais s'il ne parle pas ! » Et alors il ne parlait pas, mais mimait de manière très amusante et donc nous ne comprenions pas. Et nous, lui parlant tranquillement en anglais lui disions : « tu veux dire ça ? Tu veux demander ça ? » Et puis il s'est avéré que c'était une sorte de blague et donc tout le monde riait. Ils prenaient la chose très gaiement. Puis nous nous sommes assis à table, mais la personnalité s'est assise exactement au centre de la table. C'est-à-dire que les tables étaient plusieurs tables jointes et il a détaché les tables au lieu de faire une seule grande tablée, il en est sorti deux. Et pourtant entre une table et l'autre il y avait très peu d'espace et cet homme, ce garçon, s'est assis au centre entre les deux tables, mais il avait très peu d'espace. Je ne comprenais pas, je disais : « mais pourquoi s'est-il assis là ? » De plus il tourne le dos à une des deux tables. Du décor, seulement cette table, les fenêtres que nous regardions depuis la fenêtre. Et les personnes qui se trouvaient là je ne les connaissais pas, c'est-à-dire qu'il y avait ma famille : mon mari et mes trois fils, la maman de cette amie à moi, et puis d'autres personnes que je ne connais pas en revanche. Au début nous étions indécis si rester ou si sortir. Si nous sortions nous devions visiter cette ville où nous nous trouvions, qui n'était pas ma ville. Et donc nous étions tiraillés parce que nous disions, on pourrait aller visiter la ville ou rester ici, mais la ville en réalité nous la connaissons quand même déjà. Et ici en revanche Aretha Franklin doit arriver, donc c'est une occasion importante.;;;
2653;2653 Ce soir ça a été une soirée disons avec des horaires très serrés. Je suis rentrée de chez mon père, j'ai dû tout de suite me mettre à préparer le dîner et puis après le dîner j'ai regardé la télévision, je me suis endormie sur le canapé parce que j'étais vraiment très fatiguée. Et donc maintenant je retourne dormir parce que je continue à être très fatiguée.;;;
2654;2654 La maison où je suis née, je faisais tout un travail de nettoyage, de rangement, sur la terrasse, il y avait une grande terrasse et dans le grenier, et donc j'avais cette envie de mettre de l'ordre, évidemment sans jamais arriver à terminer.;;;
2655;2655 Dernièrement les premières heures de l'après-midi, j'ai un gros coup de barre et je dois dormir, donc genre je me retrouve toujours dans une condition où je ne pense de toute façon à rien, je ne suis disons pas inquiète ou de toute façon soucieuse, je dors, donc genre moins que zéro et aujourd'hui aussi c'est comme ça. Et donc essentiellement je me suis réveillée d'un coup à cause du tonnerre. Je me suis détendue, je me suis mise, j'ai fermé les yeux et je n'ai pensé à rien pratiquement, donc je me suis assez détendue.;;;
2656;2656 Quelques vagues sensations d'anxiété et d'avoir perdu quelque chose.;;;
2657;2657 Je viens de terminer un appel téléphonique de travail avec une fille italienne au Mexique, donc j'étais assez concentré au travail. En réalité en train de survivre maintenant parce que c'est un sujet dont je ne connais pas trop les détails, je n'en sais que les grandes lignes, donc j'essayais de me débrouiller avec les quelques notions que j'avais... enfin, j'essayais d'apprendre. Et des états émotionnels bons, neutres : je vais bien, maintenant je dois courir ailleurs à la nouvelle maison et puis après je dois retourner au travail parce que j'ai un autre engagement, donc un peu sous pression, mais tout compte fait bien... tout sous contrôle.;;;
2658;2658 Il y avait ma maman à table chez moi et nous discutions du fait que ma maman ne m'avait pas dit, de la part de ma grand-mère, d'un site internet où écouter de la musique et qui m'aurait beaucoup intéressé. Et puis moi je me mets à faire le café au lait, je le faisais après le déjeuner euh en mettant dans une casserole beaucoup de litres d'eau plus le café qui restait du matin. Et puis je demandais à mon frère s'il en voulait un peu. Il y avait aussi mon papa et mon frère justement, on regardait aussi un film à la télé.;;;
2659;2659 J'ai regardé une série TV. J'ai eu une humeur assez neutre, tendant un peu au triste, mais quand même assez neutre. Je n'ai rien fait de particulier, j'ai regardé une série et fait des caresses au chien et c'est tout.;;;
2660;2660 Je viens de rentrer du travail. Maintenant je pense que je vais faire un peu de stretching, une bonne douche. Et puis après je pense que je préparerai à dîner. Longue journée aujourd'hui. Mais bonne, allez.;;;
2661;2661 Il est quatorze heures cinquante et j'ai le souffle court parce que je suis allée étendre le linge. Journée à la maison, consacrée à ranger la maison, chose que je n'ai pas l'occasion de faire pendant la semaine. Ce que j'ai autour de moi c'est une maison à ranger et un état d'esprit tranquille, normal.;;;
2662;2662 Je tenais les mains devant les yeux.;;;
2663;2663 Alors, je faisais du yoga, et je pensais à une série de choses. Et bon, l'une d'elles était que je pensais pendant que je le faisais que la fille qui animait le cours allait vraiment trop vite, et puis que c'était un peu bizarre de le faire à Bishop en vingt minutes de yoga et voilà dans tout ça il me venait aussi à l'esprit que je ne m'étais pas coupé les ongles des pieds et à un certain moment ça me faisait me sentir un peu embarrassé parce que les ongles un peu longs, et en réalité ils n'étaient pas longs mais genre ils étaient comme ça au hasard, dans le sens genre je ne m'en occupe pas, comme ça. Et puis voilà j'avais aussi pensé qu'en short comme ça j'ai plein de poils sur les jambes, je me sentais parfois trop poilu et puis je sentais l'effet du yoga qui était justement celui de boh, de me détendre. Je venais d'un moment où j'étais vraiment tendu, j'essayais justement de préparer cette présentation et je n'y arrivais pas, je sentais les épaules vraiment tendues, crispées, donc après environ dix minutes de yoga en revanche je me sentais extrêmement plus détendu et même j'avais presque envie de dormir, de m'endormir et voilà, comme ça.;;;
2664;2664 Je viens de finir de faire cours pour [INSTITUTION1], donc je suis fatigué, sans voix et particulièrement affamé mais assez content, comme toujours, parce que faire cours en tant qu'enseignant me donne toujours beaucoup d'élan, beaucoup d'énergie. Je suis à [PLACE1], il y a une humidité très élevée, il bruine mais surtout j'ai faim en ce moment. Je vais à la voiture, en espérant trouver moins de circulation. Je n'ai fondamentalement pas pensé parce que je faisais cours donc je suivais simplement le flux des mots que je sais par cœur, mais de toute façon quand je présente le cours je ne pense pas, c'est-à-dire que les mots prennent le dessus et donc je suis simplement les mots. Ok.;;;
2665;2665 J'étais dans une cave. Vraiment les caves où l'on fait le vin, où l'on garde le vin avec les tonneaux. Et les petites briques, les voûtes en berceau, [MISSING]. Il y avait un peu de monde. Le seul que j'ai reconnu immédiatement c'est mon frère et nous faisions une dégustation de vins et de charcuteries. Moi je mangeais les charcuteries, à part comme si c'était tout du salami, donc coupé en rondelles et donc ça me convenait jusqu'à un certain point. Mais, puis justement pour une raison quelconque je n'avais pas le vin dans le verre, mais pour une raison quelconque le vin aussi était coupé en rondelles. Ces rondelles de vin moi je ne les voyais pas, je voyais celles de salami, mais je savais qu'avec le vin il se passerait la même chose.;;;
